{
  "message_id": "fcore-delivery-2026-05-06-issue106-review",
  "schema_type": "delivery_review_packet",
  "schema_version": "1.0.0",
  "project": "fractal-core",
  "from_role": "delivery-architect",
  "to_role": "techlead",
  "created_at": "2026-05-06T12:30:00Z",
  "correlation_id": "issue-106",
  "github_context": {
    "repo": "billyweisberg/fractal-core-python",
    "issue_number": 106,
    "pr_number": 107,
    "branch": "issue-106-delivery",
    "links": [
      "https://github.com/billyweisberg/fractal-core-python/issues/106",
      "https://github.com/billyweisberg/fractal-core-python/pull/107"
    ]
  },
  "payload": {
    "issue": {
      "number": 106,
      "url": "https://github.com/billyweisberg/fractal-core-python/issues/106"
    },
    "branch": {
      "name": "issue-106-delivery"
    },
    "pr": {
      "number": 107,
      "url": "https://github.com/billyweisberg/fractal-core-python/pull/107",
      "ready_for_review": true
    },
    "review_type": "delivery_architecture_review",
    "result_type": "ready_for_dev",
    "scope_recommendation": {
      "action": "proceed_as_assigned",
      "notes": [
        "Current assignment scope is narrow enough for implementation."
      ]
    },
    "authority_impact": {
      "level": "none",
      "details": "No published authority changes are required for this slice."
    },
    "branch_recommendation": {
      "action": "keep_current_lineage",
      "notes": [
        "Current canonical issue lineage is acceptable."
      ]
    },
    "techlead_action_recommended": {
      "action": "assign_worker",
      "target_role": "Python Dev",
      "reason": "Delivery review found the scope ready for implementation."
    },
    "review_summary": "Delivery Architect reviewed the authorized slice and recommends handing implementation to a worker role.",
    "findings": [],
    "source_assignment_ref": {
      "message_id": "fcore-techlead-2026-05-06-issue106-delivery-review",
      "assignment_type": "delivery_architecture_review",
      "target_role": "Delivery Architect",
      "path": "{{SOURCE_ASSIGNMENT_PATH}}"
    },
    "coder_run_brief_ref": {
      "path": "{{CODER_RUN_BRIEF_PATH}}",
      "schema_path": "{{CODER_RUN_BRIEF_SCHEMA_PATH}}",
      "brief_id": "fcore-coder-2026-05-02-issue106-retirement-boundary-diagnostics"
    },
    "coder_run_brief": {
      "brief_id": "fcore-coder-2026-05-02-issue106-retirement-boundary-diagnostics"
    },
    "coder_brief_resolution": {
      "package_id_external": "fcore-stage1-2026-05-02-issue106-retirement-boundary-diagnostics",
      "brief_id_external": "fcore-coder-2026-05-02-issue106-retirement-boundary-diagnostics",
      "readiness_state": "execution_ready",
      "parallel_group_id": null
    }
  },
  "authority_context": {
    "manifest_path": "{{AUTHORITY_MANIFEST_PATH}}",
    "authority_version": "2026-05-03.1",
    "milestone_id": "m1-reference-implementation",
    "phase_id": "p6-forward-semantic-target",
    "task_id": "py-p6-retirement-boundary-diagnostics"
  }
}
